<!DOCTYPE graphml SYSTEM "GraphML.dtd">
<graphml>
<graph edgedefault="directed">

<key id="#META_API" for="node">String</key>
<key id="#META_DIST" for="node">String</key>
<key id="#META_SELECT" for="node">Boolean</key>
<key id="#META_OLD_ID" for="node">String</key>
<key id="name" for="node">String</key>
<key id="DOI_API" for="node">Float</key>
<key id="DOI_DIST" for="node">Float</key>
<key id="DOI" for="node">Float</key>

<key id="ref" for="edge">String</key>
<key id="#META_REF" for="edge">String</key>
<key id="#META_OLD_REF" for="edge">String</key>

<node id="0">
	<data key="#META_API">init</data>
</node>
<node id="1"></node>
<node id="2"></node>
<node id="3"></node>
<node id="4"></node>
<node id="5"></node>
<node id="6"></node>
<node id="7"></node>
<node id="8"></node>
<node id="9">
	<data key="#META_API">exit</data>
</node>

<edge source="7" target="8"></edge>
<edge source="0" target="1"></edge>
<edge source="0" target="2"></edge>
<edge source="1" target="3"></edge>
<edge source="1" target="4"></edge>
<edge source="1" target="5"></edge>
<edge source="2" target="6"></edge>
<edge source="5" target="6"></edge>
<edge source="5" target="8"></edge>
<edge source="3" target="7"></edge>
<edge source="6" target="8"></edge>
<edge source="8" target="9"></edge>
<edge source="4" target="9"></edge>

</graph>
</graphml>
